{
  "schema_version": "1.0.0",
  "submission_id": "mapdl-pending-001",
  "profile": {"id": "mapdl-v211-pending", "version": "1.0.0"},
  "adapter": "mapdl_v211",
  "timeout_sec": 7200,
  "parameters": {},
  "resources": {"cpu": 4, "memory_mb": 4096, "licenses": {"ansys_structures": 1}},
  "notification": {"recipients": []}
}

